{"template_id":"TMPL-GENERIC-01","work_type":"FEATURE","name":"Generic Fallback","description":"Fallback template when no specific WorkType template matches. All promises default to manual review.","default_risk_cap":"MEDIUM","default_scope_rules":{"contract_changes_allowed":false,"schema_changes_allowed":false,"destructive_ops_allowed":false,"new_dependencies_allowed":false,"test_changes_required":true},"default_promises":[{"description":"User-specified changes implemented","verification_method":"manual_review","required":true},{"description":"Scope declared and respected","verification_method":"manual_review","required":true}],"clarifying_questions":[{"question":"What specific changes are you requesting?","options":[],"maps_to":"promises[0].description"},{"question":"Which files and modules are in scope?","options":[],"maps_to":"scope.files"}],"example_contract":"CONTRACT: CTR-GENERIC01\n  TYPE: FEATURE\n  SCOPE: [user-specified]\n  MODULES: [user-specified]\n  RISK CAP: MEDIUM\n  PROMISES:\n    1. Implement changes → verify: manual_review\n    2. Scope respected → verify: manual_review\n  STATUS: proposed"}
