{"template_id":"TMPL-SCHEMA-01","work_type":"SCHEMA","name":"Schema Change","description":"Modify data model, migration, field type, or event schema.","default_risk_cap":"HIGH","default_scope_rules":{"contract_changes_allowed":true,"schema_changes_allowed":true,"destructive_ops_allowed":false,"new_dependencies_allowed":false,"test_changes_required":true},"default_promises":[{"description":"Up migration produces correct schema","verification_method":"migration_test","required":true},{"description":"Down migration reverses cleanly","verification_method":"migration_test","required":true},{"description":"Data integrity preserved after migration","verification_method":"test_passes","required":true},{"description":"Rollback plan documented","verification_method":"diff_inspection","required":true}],"clarifying_questions":[{"question":"Is this an additive or destructive schema change?","options":["Additive (new column/table)","Destructive (remove/rename)","Both"],"maps_to":"default_scope_rules.destructive_ops_allowed"},{"question":"Will this affect existing data?","options":["Yes — migration needed","No — model only","Not sure"],"maps_to":"promises[0].description"}],"example_contract":"CONTRACT: CTR-SCHEMA01\n  TYPE: SCHEMA:DB_ADD\n  SCOPE: src/db/migrations/\n  MODULES: data-layer\n  RISK CAP: HIGH\n  PROMISES:\n    1. Up migration works → verify: migration_test\n    2. Down migration works → verify: migration_test\n    3. Data preserved → verify: test_passes\n  STATUS: proposed"}
