{"template_id":"TMPL-FEATURE-01","work_type":"FEATURE","name":"New Feature","description":"Add new functionality, endpoint, component, or behavior to an existing or new module.","default_risk_cap":"MEDIUM","default_scope_rules":{"contract_changes_allowed":false,"schema_changes_allowed":false,"destructive_ops_allowed":false,"new_dependencies_allowed":false,"test_changes_required":true},"default_promises":[{"description":"Implement specified functionality per requirements","verification_method":"diff_inspection","required":true},{"description":"Unit tests for all new functions","verification_method":"test_passes","required":true},{"description":"Integration tests for new I/O boundaries","verification_method":"test_passes","required":false},{"description":"Type check passes with no new errors","verification_method":"type_check","required":true},{"description":"Lint passes with no new violations","verification_method":"lint_pass","required":true},{"description":"No existing tests broken","verification_method":"test_passes","required":true}],"clarifying_questions":[{"question":"Is this a new module or an addition to an existing module?","options":["New module","Addition to existing module","Extension of third-party module"],"maps_to":"scope.modules"},{"question":"Does this feature expose a new API or change an existing one?","options":["New public API","Changes existing API","No API changes"],"maps_to":"scope.contract_changes_allowed"},{"question":"Does this feature require a database schema change?","options":["Yes","No","Not sure"],"maps_to":"scope.schema_changes_allowed"}],"example_contract":"CONTRACT: CTR-FEATURE01\n  TYPE: FEATURE:PLANNED\n  SCOPE: src/module/new-function.ts\n  MODULES: module-a\n  RISK CAP: MEDIUM\n  PROMISES:\n    1. Implement spec → verify: diff_inspection\n    2. Unit tests → verify: test_passes\n    3. Type check → verify: type_check\n  STATUS: proposed"}
