{"template_id":"TMPL-EXPERIMENT-01","work_type":"EXPERIMENT","name":"Experiment / Spike","description":"Research spike, proof of concept, prototype, or technology evaluation.","default_risk_cap":"LOW","default_scope_rules":{"contract_changes_allowed":false,"schema_changes_allowed":false,"destructive_ops_allowed":false,"new_dependencies_allowed":true,"test_changes_required":false},"default_promises":[{"description":"Experiment produces documented findings","verification_method":"diff_inspection","required":true},{"description":"Experiment code is disposable or flagged","verification_method":"diff_inspection","required":true},{"description":"Cleanup plan or production path stated","verification_method":"diff_inspection","required":true}],"clarifying_questions":[{"question":"What is the expected duration of this experiment?","options":["Hours","Days","Weeks","Undetermined"],"maps_to":"promises[2].description"},{"question":"Is this experiment running against production data?","options":["Yes — requires safety measures","No — isolated environment"],"maps_to":"risk_cap"}],"example_contract":"CONTRACT: CTR-EXPERIMENT01\n  TYPE: EXPERIMENT:SPIKE\n  SCOPE: experiments/\n  MODULES: research\n  RISK CAP: LOW\n  PROMISES:\n    1. Document findings → verify: diff_inspection\n    2. Code flagged disposable → verify: diff_inspection\n    3. Cleanup plan → verify: diff_inspection\n  STATUS: proposed"}
