{"template_id":"TMPL-PLAN-01","work_type":"PLAN","name":"Plan / Design","description":"Architecture design document, implementation plan, migration plan, or ADR.","default_risk_cap":"MEDIUM","default_scope_rules":{"contract_changes_allowed":false,"schema_changes_allowed":false,"destructive_ops_allowed":false,"new_dependencies_allowed":false,"test_changes_required":false},"default_promises":[{"description":"Plan documents all affected modules and services","verification_method":"diff_inspection","required":true},{"description":"Risk assessment for each phase of the plan","verification_method":"diff_inspection","required":true},{"description":"Stakeholder review scheduled","verification_method":"manual_review","required":true}],"clarifying_questions":[{"question":"Is this a high-level architecture plan or detailed implementation plan?","options":["Architecture (HLD)","Detailed implementation (LLD)","Migration plan"],"maps_to":"work_type.sub_type"},{"question":"Who are the stakeholders that need to review?","options":["Engineering team only","Cross-team","External stakeholders"],"maps_to":"promises[2].description"}],"example_contract":"CONTRACT: CTR-PLAN0001\n  TYPE: PLAN:ARCHITECTURE\n  SCOPE: docs/adr/\n  MODULES: architecture\n  RISK CAP: MEDIUM\n  PROMISES:\n    1. All modules documented → verify: diff_inspection\n    2. Risk assessment per phase → verify: diff_inspection\n    3. Review scheduled → verify: manual_review\n  STATUS: proposed"}
