{"template_id":"TMPL-CONFIG-01","work_type":"CONFIG","name":"Configuration Change","description":"Modify environment variables, feature flags, CI/CD configuration, or deployment parameters.","default_risk_cap":"HIGH","default_scope_rules":{"contract_changes_allowed":false,"schema_changes_allowed":false,"destructive_ops_allowed":false,"new_dependencies_allowed":false,"test_changes_required":false},"default_promises":[{"description":"Application starts with new config","verification_method":"compiles","required":true},{"description":"Critical path works with new config","verification_method":"test_passes","required":true},{"description":"Rollback to previous config is possible","verification_method":"diff_inspection","required":true}],"clarifying_questions":[{"question":"Does this change affect production?","options":["Yes — all environments","Yes — specific environment only","No — dev/test only"],"maps_to":"risk_cap"},{"question":"Is this a secret or credential change?","options":["Yes — secret rotation","No — non-sensitive config"],"maps_to":"work_type.sub_type"}],"example_contract":"CONTRACT: CTR-CONFIG01\n  TYPE: CONFIG:ENV_ADD\n  SCOPE: .env.example, config.ts\n  MODULES: config\n  RISK CAP: HIGH\n  PROMISES:\n    1. App starts → verify: compiles\n    2. Critical path works → verify: test_passes\n    3. Rollback possible → verify: diff_inspection\n  STATUS: proposed"}
