{"template_id":"TMPL-CONTRACT-01","work_type":"CONTRACT","name":"Contract Change","description":"Modify API boundary, type export, function signature, event shape, or interface.","default_risk_cap":"HIGH","default_scope_rules":{"contract_changes_allowed":true,"schema_changes_allowed":false,"destructive_ops_allowed":false,"new_dependencies_allowed":false,"test_changes_required":true},"default_promises":[{"description":"Consumer verification passes for all affected consumers","verification_method":"contract_test","required":true},{"description":"Breaking changes documented with migration path","verification_method":"diff_inspection","required":true},{"description":"Backward compatibility maintained or version negotiated","verification_method":"diff_inspection","required":true},{"description":"All callers updated to match new contract","verification_method":"test_passes","required":true}],"clarifying_questions":[{"question":"Is this a breaking change?","options":["Breaking — consumer must adapt","Non-breaking — backward compatible","Unsure"],"maps_to":"work_type.sub_type"},{"question":"How many consumers are affected?","options":["1-3","4-10","10+","Unknown"],"maps_to":"risk_cap"}],"example_contract":"CONTRACT: CTR-CONTRACT01\n  TYPE: CONTRACT:RESPONSE\n  SCOPE: src/api/endpoint.ts\n  MODULES: api\n  RISK CAP: HIGH\n  PROMISES:\n    1. Consumer tests pass → verify: contract_test\n    2. Migration path documented → verify: diff_inspection\n    3. All callers updated → verify: test_passes\n  STATUS: proposed"}
