{"template_id":"TMPL-INFRA-01","work_type":"INFRA","name":"Infrastructure Change","description":"Provision or modify infrastructure — Docker, Kubernetes, Terraform, cloud resources.","default_risk_cap":"HIGH","default_scope_rules":{"contract_changes_allowed":false,"schema_changes_allowed":false,"destructive_ops_allowed":false,"new_dependencies_allowed":false,"test_changes_required":false},"default_promises":[{"description":"Idempotent apply — second run produces no changes","verification_method":"diff_inspection","required":true},{"description":"Plan reviewed before apply","verification_method":"manual_review","required":true},{"description":"Rollback procedure documented","verification_method":"diff_inspection","required":true}],"clarifying_questions":[{"question":"Is this a production infrastructure change?","options":["Yes — production","Yes — staging","No — development"],"maps_to":"risk_cap"},{"question":"Does this affect networking, IAM, or security groups?","options":["Yes — CRITICAL floor","No — compute/storage only"],"maps_to":"work_type.sub_type"}],"example_contract":"CONTRACT: CTR-INFRA001\n  TYPE: INFRA:DOCKER\n  SCOPE: Dockerfile, docker-compose.yml\n  MODULES: deploy\n  RISK CAP: HIGH\n  PROMISES:\n    1. Idempotent apply → verify: diff_inspection\n    2. Plan reviewed → verify: manual_review\n    3. Rollback documented → verify: diff_inspection\n  STATUS: proposed"}
