{"template_id":"TMPL-INCIDENT-01","work_type":"INCIDENT","name":"Incident Response","description":"Respond to production incident — outage, data loss, security breach, or degradation.","default_risk_cap":"CRITICAL","default_scope_rules":{"contract_changes_allowed":true,"schema_changes_allowed":true,"destructive_ops_allowed":true,"new_dependencies_allowed":true,"test_changes_required":false},"default_promises":[{"description":"Mitigate the incident and restore service","verification_method":"manual_review","required":true},{"description":"Root cause identified and documented","verification_method":"diff_inspection","required":true},{"description":"Post-mortem scheduled within 72 hours","verification_method":"manual_review","required":true}],"clarifying_questions":[{"question":"What is the incident severity?","options":["SEV1 — service unavailable","SEV2 — degraded","SEV3 — minor issue"],"maps_to":"risk_cap"},{"question":"Is rollback the mitigation strategy?","options":["Yes — rollback to previous version","No — hotfix forward","Not yet determined"],"maps_to":"promises[0].description"}],"example_contract":"CONTRACT: CTR-INCIDENT01\n  TYPE: INCIDENT:OUTAGE\n  SCOPE: [affected services]\n  MODULES: [affected modules]\n  RISK CAP: CRITICAL\n  PROMISES:\n    1. Mitigate → verify: manual_review\n    2. Root cause → verify: diff_inspection\n    3. Post-mortem → verify: manual_review\n  STATUS: proposed"}
