{"template_id":"TMPL-REFACTOR-01","work_type":"REFACTOR","name":"Refactor","description":"Restructure code without changing external behavior.","default_risk_cap":"MEDIUM","default_scope_rules":{"contract_changes_allowed":false,"schema_changes_allowed":false,"destructive_ops_allowed":false,"new_dependencies_allowed":false,"test_changes_required":true},"default_promises":[{"description":"All existing tests pass unchanged","verification_method":"test_passes","required":true},{"description":"External behavior is identical","verification_method":"diff_inspection","required":true},{"description":"Public API surface unchanged","verification_method":"diff_inspection","required":true}],"clarifying_questions":[{"question":"Is this a rename of any public symbol?","options":["Yes — public symbol renamed","No — internal only"],"maps_to":"risk_cap"},{"question":"Are you extracting logic to a new module?","options":["Yes — extract to new file","No — in-place restructure"],"maps_to":"scope.files"}],"example_contract":"CONTRACT: CTR-REFACTOR01\n  TYPE: REFACTOR:EXTRACT\n  SCOPE: src/module/large-file.ts\n  MODULES: module-a\n  RISK CAP: MEDIUM\n  PROMISES:\n    1. All tests pass → verify: test_passes\n    2. Behavior identical → verify: diff_inspection\n    3. Public API unchanged → verify: diff_inspection\n  STATUS: proposed"}
