{"template_id":"TMPL-FIX-01","work_type":"FIX","name":"Bug Fix","description":"Fix a bug, error, crash, regression, or security vulnerability.","default_risk_cap":"HIGH","default_scope_rules":{"contract_changes_allowed":false,"schema_changes_allowed":false,"destructive_ops_allowed":false,"new_dependencies_allowed":false,"test_changes_required":true},"default_promises":[{"description":"Reproduce the bug to confirm root cause","verification_method":"diff_inspection","required":true},{"description":"Apply fix that resolves the root cause","verification_method":"diff_inspection","required":true},{"description":"Reproduction test passes after fix","verification_method":"test_passes","required":true},{"description":"Regression test added to prevent recurrence","verification_method":"test_exists","required":true},{"description":"No existing tests broken","verification_method":"test_passes","required":true}],"clarifying_questions":[{"question":"Is this a security vulnerability fix?","options":["Yes — treat as CRITICAL","No — standard bug fix"],"maps_to":"work_type.sub_type"},{"question":"Is this a production incident or a development bug?","options":["Production incident","Development bug","Pre-production testing"],"maps_to":"risk_cap"},{"question":"Do you have reproduction steps or error output?","options":["Error output available","Reproduction steps known","Neither — investigate first"],"maps_to":"promises[0].description"}],"example_contract":"CONTRACT: CTR-FIX00001\n  TYPE: FIX:BUG\n  SCOPE: src/module/buggy-file.ts\n  MODULES: module-a\n  RISK CAP: HIGH\n  PROMISES:\n    1. Reproduce bug → verify: diff_inspection\n    2. Apply fix → verify: diff_inspection\n    3. Reproduction test passes → verify: test_passes\n  STATUS: proposed"}
